{
  "schemaVersion": 1,
  "date": "2026-08-20",
  "generatedAt": "2026-09-30T20:34:11Z",
  "researchWindow": {
    "from": "2026-08-14",
    "to": "2026-08-20"
  },
  "attacks": [
    {
      "id": "attack-20260820-kyiv-city",
      "scope": "kyiv-city",
      "date": "2026-08-20",
      "threatTypes": [
        "combined"
      ],
      "summary": "A large combined missile and UAV attack struck Kyiv, causing severe residential and civilian damage across several districts.",
      "verification": "confirmed",
      "casualties": {
        "killed": 15,
        "injured": 39,
        "status": "confirmed"
      },
      "confidence": "high",
      "sources": [
        {
          "publisher": "Kyiv City Portal",
          "type": "official",
          "url": "https://kyivcity.gov.ua/news/vitaliy_klichko_vzhe_15_zagiblikh_vnaslidok_masovano_ataki_na_stolitsyu_na_mistsyakh_poshkodzhen_trivaye_likvidatsiya_naslidkiv_ataki/"
        },
        {
          "publisher": "National Police of Ukraine",
          "type": "official",
          "url": "https://npu.gov.ua/news/raketna-ataka-na-stolytsiu-zabrala-zhyttia-12-liudei-shche-34-postrazhdaly-politsiia-kyieva"
        }
      ]
    },
    {
      "id": "attack-20260820-kyiv-oblast",
      "scope": "kyiv-oblast",
      "date": "2026-08-20",
      "threatTypes": [
        "combined"
      ],
      "summary": "Kyiv Oblast was struck in the same combined attack, causing fires and damage to civilian and industrial objects.",
      "verification": "confirmed",
      "casualties": {
        "killed": 1,
        "injured": 7,
        "status": "confirmed"
      },
      "confidence": "high",
      "sources": [
        {
          "publisher": "LB.ua / Kyiv OVA",
          "type": "media",
          "url": "https://lb.ua/society/2026/08/20/760216_kiyivschini_cherez_obstril.html"
        },
        {
          "publisher": "Vechirniy Kyiv / DSNS",
          "type": "media",
          "url": "https://vechirniy.kyiv.ua/news/131417/"
        }
      ]
    }
  ],
  "incidents": [
    {
      "id": "incident-20260820-solomianskyi",
      "attackId": "attack-20260820-kyiv-city",
      "scope": "kyiv-city",
      "date": "2026-08-20",
      "area": {
        "name": "Solomianskyi district",
        "level": "district",
        "map": {
          "lat": 50.43,
          "lng": 30.46,
          "precision": "district-centroid",
          "radiusMeters": 3000,
          "displayMode": "area"
        },
        "sourceLocation": {
          "text": "Solomianskyi district",
          "specificity": "district",
          "officiallyPublished": true,
          "sourceUrl": "https://kyivcity.gov.ua/news/vitaliy_klichko_vzhe_15_zagiblikh_vnaslidok_masovano_ataki_na_stolitsyu_na_mistsyakh_poshkodzhen_trivaye_likvidatsiya_naslidkiv_ataki/"
        }
      },
      "impactType": "damage",
      "threatTypes": [
        "combined"
      ],
      "summary": "A nine-storey residential building suffered major destruction on upper floors and fire; nearby buildings were also damaged. Ten deaths were attributed to the district.",
      "casualties": {
        "killed": 10,
        "injured": 0,
        "status": "confirmed"
      },
      "damage": [
        {
          "type": "residential",
          "count": null,
          "description": "A nine-storey residential building and nearby buildings sustained major damage."
        }
      ],
      "verification": "confirmed",
      "confidence": "high",
      "sources": [
        {
          "publisher": "Kyiv City Portal",
          "type": "official",
          "url": "https://kyivcity.gov.ua/news/vitaliy_klichko_vzhe_15_zagiblikh_vnaslidok_masovano_ataki_na_stolitsyu_na_mistsyakh_poshkodzhen_trivaye_likvidatsiya_naslidkiv_ataki/"
        }
      ]
    },
    {
      "id": "incident-20260820-brovary-raion",
      "attackId": "attack-20260820-kyiv-oblast",
      "scope": "kyiv-oblast",
      "date": "2026-08-20",
      "area": {
        "name": "Brovarskyi raion",
        "level": "raion",
        "map": {
          "lat": 50.51,
          "lng": 30.79,
          "precision": "raion-centroid",
          "radiusMeters": 5000,
          "displayMode": "area"
        },
        "sourceLocation": {
          "text": "Brovary raion",
          "specificity": "raion",
          "officiallyPublished": true,
          "sourceUrl": "https://lb.ua/society/2026/08/20/760216_kiyivschini_cherez_obstril.html"
        }
      },
      "impactType": "damage",
      "threatTypes": [
        "combined"
      ],
      "summary": "A man was killed during the attack in Brovary raion; an industrial object was reported damaged in the oblast attack.",
      "casualties": {
        "killed": 1,
        "injured": 0,
        "status": "confirmed"
      },
      "damage": [
        {
          "type": "industrial",
          "count": null,
          "description": "An industrial object was damaged during the oblast attack."
        }
      ],
      "verification": "confirmed",
      "confidence": "high",
      "sources": [
        {
          "publisher": "LB.ua / Kyiv OVA",
          "type": "media",
          "url": "https://lb.ua/society/2026/08/20/760216_kiyivschini_cherez_obstril.html"
        }
      ]
    },
    {
      "id": "incident-completeness-20260820-darnytskyi-district",
      "scope": "kyiv-city",
      "date": "2026-08-20",
      "area": {
        "name": "Darnytskyi district",
        "level": "district",
        "map": {
          "lat": 50.41,
          "lng": 30.68,
          "precision": "district-centroid",
          "radiusMeters": 2500,
          "displayMode": "area"
        }
      },
      "impactType": "unknown",
      "threatTypes": [
        "unknown"
      ],
      "summary": "Physical consequences were reported in Darnytskyi district; this reconciliation records only the supported administrative area.",
      "casualties": {
        "killed": null,
        "injured": null,
        "status": "unknown"
      },
      "damage": [],
      "verification": "provisional",
      "confidence": "medium",
      "sources": [
        {
          "publisher": "Ukrainska Pravda",
          "type": "media",
          "url": "https://www.pravda.com.ua/news/2026/08/20/8049474/"
        }
      ]
    },
    {
      "id": "incident-completeness-20260820-sviatoshynskyi-district",
      "scope": "kyiv-city",
      "date": "2026-08-20",
      "area": {
        "name": "Sviatoshynskyi district",
        "level": "district",
        "map": {
          "lat": 50.46,
          "lng": 30.37,
          "precision": "district-centroid",
          "radiusMeters": 2500,
          "displayMode": "area"
        }
      },
      "impactType": "unknown",
      "threatTypes": [
        "unknown"
      ],
      "summary": "Physical consequences were reported in Sviatoshynskyi district; this reconciliation records only the supported administrative area.",
      "casualties": {
        "killed": null,
        "injured": null,
        "status": "unknown"
      },
      "damage": [],
      "verification": "provisional",
      "confidence": "medium",
      "sources": [
        {
          "publisher": "Ukrainska Pravda",
          "type": "media",
          "url": "https://www.pravda.com.ua/news/2026/08/20/8049422/"
        }
      ]
    },
    {
      "id": "incident-completeness-20260820-boryspilskyi-raion",
      "scope": "kyiv-oblast",
      "date": "2026-08-20",
      "area": {
        "name": "Boryspilskyi raion",
        "level": "raion",
        "map": {
          "lat": 50.33,
          "lng": 31,
          "precision": "raion-centroid",
          "radiusMeters": 5000,
          "displayMode": "area"
        }
      },
      "impactType": "unknown",
      "threatTypes": [
        "unknown"
      ],
      "summary": "Physical consequences were reported in Boryspilskyi raion; this reconciliation records only the supported administrative area.",
      "casualties": {
        "killed": null,
        "injured": null,
        "status": "unknown"
      },
      "damage": [],
      "verification": "provisional",
      "confidence": "medium",
      "sources": [
        {
          "publisher": "Ukrainska Pravda",
          "type": "media",
          "url": "https://www.pravda.com.ua/news/2026/08/20/8049480/"
        }
      ]
    },
    {
      "id": "incident-completeness-20260820-desnianskyi-district",
      "scope": "kyiv-city",
      "date": "2026-08-20",
      "area": {
        "name": "Desnianskyi district",
        "level": "district",
        "map": {
          "lat": 50.53,
          "lng": 30.63,
          "precision": "district-centroid",
          "radiusMeters": 2500,
          "displayMode": "area"
        }
      },
      "impactType": "unknown",
      "threatTypes": [
        "unknown"
      ],
      "summary": "Physical consequences were reported in Desnianskyi district; this reconciliation records only the supported administrative area.",
      "casualties": {
        "killed": null,
        "injured": null,
        "status": "unknown"
      },
      "damage": [],
      "verification": "provisional",
      "confidence": "medium",
      "sources": [
        {
          "publisher": "Ukrainska Pravda",
          "type": "media",
          "url": "https://www.pravda.com.ua/news/2026/08/20/8049542/"
        }
      ]
    }
  ]
}
