{
  "schemaVersion": 1,
  "date": "2026-09-02",
  "generatedAt": "2026-09-30T20:34:49Z",
  "researchWindow": {
    "from": "2026-08-28",
    "to": "2026-09-03"
  },
  "attacks": [
    {
      "id": "attack-20260902-kyiv-city",
      "scope": "kyiv-city",
      "date": "2026-09-02",
      "threatTypes": [
        "uav"
      ],
      "summary": "Repeated Russian UAV attacks damaged residential, educational and other civilian buildings in Kyiv.",
      "verification": "confirmed",
      "casualties": {
        "killed": 0,
        "injured": 13,
        "status": "confirmed"
      },
      "confidence": "high",
      "sources": [
        {
          "publisher": "Kyiv City Portal",
          "type": "official",
          "url": "https://kyivcity.gov.ua/news/vorozha_ataka_na_stolitsyu_2_veresnya_informatsiya_onovlyuyetsya/"
        },
        {
          "publisher": "LB.ua",
          "type": "media",
          "url": "https://lb.ua/society/2026/09/02/763050_droni_atakuvali_kiyiv_udari.html"
        }
      ]
    }
  ],
  "incidents": [
    {
      "id": "incident-20260902-kyiv-city",
      "attackId": "attack-20260902-kyiv-city",
      "scope": "kyiv-city",
      "date": "2026-09-02",
      "area": {
        "name": "Kyiv",
        "level": "city",
        "map": {
          "lat": 50.4501,
          "lng": 30.5234,
          "precision": "city-centroid",
          "radiusMeters": 8000,
          "displayMode": "area"
        }
      },
      "impactType": "damage",
      "threatTypes": [
        "uav"
      ],
      "summary": "Later reporting raised the number of people affected to 13; attacks damaged residential buildings, an educational facility and warehouses in several districts.",
      "casualties": {
        "killed": 0,
        "injured": 13,
        "status": "confirmed"
      },
      "damage": [
        {
          "type": "buildings",
          "count": null,
          "description": "Residential, educational and warehouse buildings were damaged."
        }
      ],
      "verification": "confirmed",
      "confidence": "high",
      "sources": [
        {
          "publisher": "Kyiv City Portal",
          "type": "official",
          "url": "https://kyivcity.gov.ua/news/vorozha_ataka_na_stolitsyu_2_veresnya_informatsiya_onovlyuyetsya/"
        },
        {
          "publisher": "LB.ua",
          "type": "media",
          "url": "https://lb.ua/society/2026/09/02/763050_droni_atakuvali_kiyiv_udari.html"
        }
      ]
    },
    {
      "id": "incident-completeness-20260902-brovarskyi-raion",
      "scope": "kyiv-oblast",
      "date": "2026-09-02",
      "area": {
        "name": "Brovarskyi raion",
        "level": "raion",
        "map": {
          "lat": 50.51,
          "lng": 30.79,
          "precision": "raion-centroid",
          "radiusMeters": 5000,
          "displayMode": "area"
        }
      },
      "impactType": "unknown",
      "threatTypes": [
        "unknown"
      ],
      "summary": "Physical consequences were reported in Brovarskyi raion; this reconciliation records only the supported administrative area.",
      "casualties": {
        "killed": null,
        "injured": null,
        "status": "unknown"
      },
      "damage": [],
      "verification": "provisional",
      "confidence": "medium",
      "sources": [
        {
          "publisher": "Ukrainska Pravda",
          "type": "media",
          "url": "https://www.pravda.com.ua/news/2026/09/02/8051460/"
        }
      ]
    },
    {
      "id": "incident-completeness-20260902-buchanskyi-raion",
      "scope": "kyiv-oblast",
      "date": "2026-09-02",
      "area": {
        "name": "Buchanskyi raion",
        "level": "raion",
        "map": {
          "lat": 50.55,
          "lng": 30.15,
          "precision": "raion-centroid",
          "radiusMeters": 5000,
          "displayMode": "area"
        }
      },
      "impactType": "unknown",
      "threatTypes": [
        "unknown"
      ],
      "summary": "Physical consequences were reported in Buchanskyi raion; this reconciliation records only the supported administrative area.",
      "casualties": {
        "killed": null,
        "injured": null,
        "status": "unknown"
      },
      "damage": [],
      "verification": "provisional",
      "confidence": "medium",
      "sources": [
        {
          "publisher": "Ukrainska Pravda",
          "type": "media",
          "url": "https://www.pravda.com.ua/news/2026/09/02/8051460/"
        }
      ]
    },
    {
      "id": "incident-completeness-20260902-holosiivskyi-district",
      "scope": "kyiv-city",
      "date": "2026-09-02",
      "area": {
        "name": "Holosiivskyi district",
        "level": "district",
        "map": {
          "lat": 50.39,
          "lng": 30.51,
          "precision": "district-centroid",
          "radiusMeters": 3500,
          "displayMode": "area"
        }
      },
      "impactType": "unknown",
      "threatTypes": [
        "unknown"
      ],
      "summary": "Physical consequences were reported in Holosiivskyi district; this reconciliation records only the supported administrative area.",
      "casualties": {
        "killed": null,
        "injured": null,
        "status": "unknown"
      },
      "damage": [],
      "verification": "provisional",
      "confidence": "medium",
      "sources": [
        {
          "publisher": "Ukrainska Pravda",
          "type": "media",
          "url": "https://www.pravda.com.ua/news/2026/09/02/8051474/"
        }
      ]
    },
    {
      "id": "incident-completeness-20260902-shevchenkivskyi-district",
      "scope": "kyiv-city",
      "date": "2026-09-02",
      "area": {
        "name": "Shevchenkivskyi district",
        "level": "district",
        "map": {
          "lat": 50.46,
          "lng": 30.47,
          "precision": "district-centroid",
          "radiusMeters": 2500,
          "displayMode": "area"
        }
      },
      "impactType": "unknown",
      "threatTypes": [
        "unknown"
      ],
      "summary": "Physical consequences were reported in Shevchenkivskyi district; this reconciliation records only the supported administrative area.",
      "casualties": {
        "killed": null,
        "injured": null,
        "status": "unknown"
      },
      "damage": [],
      "verification": "provisional",
      "confidence": "medium",
      "sources": [
        {
          "publisher": "Ukrainska Pravda",
          "type": "media",
          "url": "https://www.pravda.com.ua/news/2026/09/02/8051474/"
        }
      ]
    }
  ]
}
