{
  "schemaVersion": 1,
  "date": "2026-08-30",
  "generatedAt": "2026-09-30T20:34:11Z",
  "researchWindow": {
    "from": "2026-08-28",
    "to": "2026-09-03"
  },
  "attacks": [
    {
      "id": "attack-20260830-kyiv-city",
      "scope": "kyiv-city",
      "date": "2026-08-30",
      "threatTypes": [
        "uav"
      ],
      "summary": "Russian UAV attacks caused fires, building damage and injuries in Kyiv.",
      "verification": "confirmed",
      "casualties": {
        "killed": 0,
        "injured": 2,
        "status": "confirmed"
      },
      "confidence": "high",
      "sources": [
        {
          "publisher": "Ukrainska Pravda / KMVA",
          "type": "media",
          "url": "https://www.pravda.com.ua/news/2026/08/30/8051031/"
        }
      ]
    },
    {
      "id": "attack-20260830-kyiv-oblast",
      "scope": "kyiv-oblast",
      "date": "2026-08-30",
      "threatTypes": [
        "uav"
      ],
      "summary": "Russian UAV attacks caused fires and injuries in Kyiv Oblast.",
      "verification": "confirmed",
      "casualties": {
        "killed": 0,
        "injured": 2,
        "status": "confirmed"
      },
      "confidence": "high",
      "sources": [
        {
          "publisher": "Ukrainska Pravda / DSNS",
          "type": "media",
          "url": "https://www.pravda.com.ua/news/2026/08/30/8051049/"
        }
      ]
    }
  ],
  "incidents": [
    {
      "id": "incident-20260830-kyiv-city",
      "attackId": "attack-20260830-kyiv-city",
      "scope": "kyiv-city",
      "date": "2026-08-30",
      "area": {
        "name": "Kyiv",
        "level": "city",
        "map": {
          "lat": 50.4501,
          "lng": 30.5234,
          "precision": "city-centroid",
          "radiusMeters": 8000,
          "displayMode": "area"
        }
      },
      "impactType": "damage",
      "threatTypes": [
        "uav"
      ],
      "summary": "Two people were injured; fires and damage were reported in several Kyiv districts.",
      "casualties": {
        "killed": 0,
        "injured": 2,
        "status": "confirmed"
      },
      "damage": [
        {
          "type": "buildings",
          "count": null,
          "description": "Non-residential and civilian buildings were damaged."
        }
      ],
      "verification": "confirmed",
      "confidence": "high",
      "sources": [
        {
          "publisher": "Ukrainska Pravda / KMVA",
          "type": "media",
          "url": "https://www.pravda.com.ua/news/2026/08/30/8051031/"
        }
      ]
    },
    {
      "id": "incident-20260830-kyiv-oblast",
      "attackId": "attack-20260830-kyiv-oblast",
      "scope": "kyiv-oblast",
      "date": "2026-08-30",
      "area": {
        "name": "Kyiv Oblast",
        "level": "oblast",
        "map": {
          "lat": 50.25,
          "lng": 30.3,
          "precision": "oblast-centroid",
          "radiusMeters": 20000,
          "displayMode": "area"
        }
      },
      "impactType": "fire",
      "threatTypes": [
        "uav"
      ],
      "summary": "Two people were injured in Fastiv and Vyshhorod raions after UAV impacts or debris caused fires.",
      "casualties": {
        "killed": 0,
        "injured": 2,
        "status": "confirmed"
      },
      "damage": [
        {
          "type": "fires",
          "count": null,
          "description": "A private home and metal structures caught fire."
        }
      ],
      "verification": "confirmed",
      "confidence": "high",
      "sources": [
        {
          "publisher": "Ukrainska Pravda / DSNS",
          "type": "media",
          "url": "https://www.pravda.com.ua/news/2026/08/30/8051049/"
        }
      ]
    },
    {
      "id": "incident-completeness-20260830-holosiivskyi-district",
      "scope": "kyiv-city",
      "date": "2026-08-30",
      "area": {
        "name": "Holosiivskyi district",
        "level": "district",
        "map": {
          "lat": 50.39,
          "lng": 30.51,
          "precision": "district-centroid",
          "radiusMeters": 3500,
          "displayMode": "area"
        }
      },
      "impactType": "unknown",
      "threatTypes": [
        "unknown"
      ],
      "summary": "Physical consequences were reported in Holosiivskyi district; this reconciliation records only the supported administrative area.",
      "casualties": {
        "killed": null,
        "injured": null,
        "status": "unknown"
      },
      "damage": [],
      "verification": "provisional",
      "confidence": "medium",
      "sources": [
        {
          "publisher": "Ukrainska Pravda",
          "type": "media",
          "url": "https://www.pravda.com.ua/news/2026/08/30/8051002/"
        }
      ]
    },
    {
      "id": "incident-completeness-20260830-pecherskyi-district",
      "scope": "kyiv-city",
      "date": "2026-08-30",
      "area": {
        "name": "Pecherskyi district",
        "level": "district",
        "map": {
          "lat": 50.43,
          "lng": 30.55,
          "precision": "district-centroid",
          "radiusMeters": 2500,
          "displayMode": "area"
        }
      },
      "impactType": "unknown",
      "threatTypes": [
        "unknown"
      ],
      "summary": "Physical consequences were reported in Pecherskyi district; this reconciliation records only the supported administrative area.",
      "casualties": {
        "killed": null,
        "injured": null,
        "status": "unknown"
      },
      "damage": [],
      "verification": "provisional",
      "confidence": "medium",
      "sources": [
        {
          "publisher": "Ukrainska Pravda",
          "type": "media",
          "url": "https://www.pravda.com.ua/news/2026/08/30/8051031/"
        }
      ]
    },
    {
      "id": "incident-completeness-20260830-vyshhorodskyi-raion",
      "scope": "kyiv-oblast",
      "date": "2026-08-30",
      "area": {
        "name": "Vyshhorodskyi raion",
        "level": "raion",
        "map": {
          "lat": 50.58,
          "lng": 30.42,
          "precision": "raion-centroid",
          "radiusMeters": 5000,
          "displayMode": "area"
        }
      },
      "impactType": "unknown",
      "threatTypes": [
        "unknown"
      ],
      "summary": "Physical consequences were reported in Vyshhorodskyi raion; this reconciliation records only the supported administrative area.",
      "casualties": {
        "killed": null,
        "injured": null,
        "status": "unknown"
      },
      "damage": [],
      "verification": "provisional",
      "confidence": "medium",
      "sources": [
        {
          "publisher": "Ukrainska Pravda",
          "type": "media",
          "url": "https://www.pravda.com.ua/news/2026/08/30/8051049/"
        }
      ]
    }
  ]
}
